{"final_document_binding":{"database_instance_fingerprint":"3549b0028b75d981cdda2e573e9cb49dedc200185876df299f912b79f69dabd8","output_copy_binding":{"byte_size":129,"dwg_header_signature":"AC1032","file_identity_fingerprint":"5f84f12b50ba4741a54325334fb204e6af77f7c30cf341c76cea2b33bb2fc222","format":"DWG","path_fingerprint":"a0af9f865bf637e6736817f4ce552e4cdf7b8c36ea75bc254c1d1f0af744b5bf","sha256":"37adae9a85f743437b2c311f5b276dc2ad88937600d43a7d34b8227efdc0db26"},"revision_fingerprint":"2b214ddf3326016519afcb268f63623b80b91a65265277668e4d020d87dd9078"},"final_revision_fingerprint":"2b214ddf3326016519afcb268f63623b80b91a65265277668e4d020d87dd9078","geometry_json":"{\"binding\":{\"adapter\":{\"id\":\"test-adapter\",\"profile\":\"test-profile\",\"version\":\"1.0.0\"},\"capabilities\":[\"read.inventory/v1\",\"read.exact_geometry/v1\"],\"document_binding_digest\":\"fe8282384718d67f35f0dddaf3a977c49c6f426522312cc95b9efe9da9a1606b\",\"host\":{\"mode\":\"full_host\",\"product\":\"external-host\",\"release\":\"1.0\",\"runtime\":\"test-runtime\"},\"plugin\":{\"fingerprint\":\"bb2b5d56f0c113ac2fd57cf5ee7a7fbc39820dc24d4a04d25d5020017999b06c\",\"id\":\"test-plugin\",\"version\":\"1.0.0\"},\"process\":{\"creation_time_100ns\":\"123456789\",\"executable_fingerprint\":\"0d3917d207eee802aa7ba4e352eb8b3990d36cc19cd8753bff2685d8e5595c10\",\"instance_fingerprint\":\"19ed40bf62c399b8492efda5b9a9184b68cf4d9d4a165b38557b9d14201d0c03\",\"pid\":1234,\"windows_session_id\":1},\"protocol_major\":1,\"protocol_minor\":0,\"protocol_version\":\"liang-pingfa/native-bridge/v1\",\"session_binding_digest\":\"9ad123ef1a9491f2a8c339af5e783f7f79f3ada8b8225e7e37dda91e46e73ed0\",\"session_id\":\"native-session-0123456789abcdef0123456789abcdef\",\"stable_host_binding_digest\":\"44849f30b1ae40bf7648a49ba3476554c15b03c5845ddd07d26dd1d2ab4d53a1\"},\"document\":{\"block_state_digest\":\"2a12da17d27cd05ab0f3148816c1b4a702334202e82c5ad0dff734cb45db8017\",\"complete_geometry_digest\":\"2c2d46d21b1f7728e5bfae0e765fe890565ff819be5e23a287c4d06f1f79e6a1\",\"container_order_digest\":\"13fb8404bb84832b777ca148fb3aef8f26197c624d5fc52af2758cdeb9dc20fc\",\"database_instance_fingerprint\":\"3549b0028b75d981cdda2e573e9cb49dedc200185876df299f912b79f69dabd8\",\"document_state_digest\":\"f8685cd124959aff65c7373ab755ed2d81f413db5c2f21a273e2c39041edbfe0\",\"layout_state_digest\":\"7c31f497d1da5b02bb278e75f812c2e45c60a17f705223fd21e7d90b8dcd210b\",\"marker_layer_fingerprint\":\"b3b6039febc1ab8ac04076e32b7b2af0444a6e76164baba744a23e1e4545786a\",\"marker_style_fingerprint\":\"edc92dc8b0b3f48a6893d4295c809499417bf4a4bccbef8aebd37877d1c4891c\",\"ordered_entity_digest\":\"05599923a8176b2bcc47ab78cff930e11b2bd58cd981a569150768f22c961b37\",\"protected_order_digest\":\"5caa91e508d04431016d497b655c3816f128de8fbe47b91ceafc150f00dadcd3\",\"protected_state_digest\":\"a03a30a5ad363346b0991d03b407c15bb47a2ad1d12c8f51ab7bce4d79c071a8\",\"revision_fingerprint\":\"2b214ddf3326016519afcb268f63623b80b91a65265277668e4d020d87dd9078\",\"table_state_digest\":\"d98a034f5cb8a0e3f07d5d8b5dc3c43723ea8d8b95199e18a82c52e072eca4dd\"},\"entities\":[{\"block_path\":[],\"bounds\":{\"maximum\":[\"4000000000000000\",\"4000000000000000\",\"0000000000000000\"],\"minimum\":[\"4000000000000000\",\"4000000000000000\",\"0000000000000000\"]},\"geometry_fingerprint\":\"808e4ad38aee5a22da3eb3a04b2069198eb629b30face1adadb69138994885a9\",\"handle\":\"10\",\"height\":\"4004000000000000\",\"layer\":\"TEMP\",\"native_type\":\"DBTEXT\",\"opaque_state_digest\":\"d7c811e07d3de31d13414099f9cf17053a1b2fee70962ce952e5dddec056d364\",\"overlay_evidence\":{\"corresponding_right_absent\":true,\"left_panel\":true,\"unique_content\":true,\"unsupported_data\":false,\"visible_interference\":true},\"owner_handle\":\"AA\",\"position\":[\"4000000000000000\",\"4000000000000000\",\"0000000000000000\"],\"rotation\":\"0000000000000000\",\"segments\":[],\"sequence_index\":0,\"space\":{\"block_handle\":null,\"kind\":\"modelspace\",\"layout_handle\":\"BB\"},\"style\":\"STANDARD\",\"text\":\"generated\"}],\"integrity\":{\"algorithm\":\"SHA-256\",\"sha256\":\"682178650f32b8ae9753ed58c5f26ca0c0a222c6817b7cc2a4df19fb7c8ad33f\"},\"owners\":[\"AA\"],\"schema_version\":\"liang-pingfa/native-geometry-export/v1\",\"source\":{\"byte_size\":129,\"dwg_header_signature\":\"AC1032\",\"file_identity_fingerprint\":\"5f84f12b50ba4741a54325334fb204e6af77f7c30cf341c76cea2b33bb2fc222\",\"format\":\"DWG\",\"path_fingerprint\":\"a0af9f865bf637e6736817f4ce552e4cdf7b8c36ea75bc254c1d1f0af744b5bf\",\"sha256\":\"37adae9a85f743437b2c311f5b276dc2ad88937600d43a7d34b8227efdc0db26\"}}","geometry_sha256":"7d6eac0ab2f8665a3c9472d6cb6de0eb725cd013593cfb81015da1da7c53b460","integrity":{"algorithm":"SHA-256","sha256":"8066db4bf55277efa746318e32e5fc7ae9e450361761ccbcbc037b9241097825"},"manifest_id":"native-manifest-cccccccccccccccccccccccccccccccc","nonce":"zzzzzzzzzzzzzzzzzzzzzzzzzzzzzzzzzzzzzzzzzzz","run_id":"native-run-eeeeeeeeeeeeeeeeeeeeeeeeeeeeeeee","schema_version":"liang-pingfa/native-console-export/v1"}
